[
  {
    "schemaVersion": 1,
    "contractId": "knockback-to-getup",
    "fromRevision": 1,
    "toRevision": 1,
    "fromHash": "65cd2360854dd58a027c77d953e5f3af58f1c297a4e20255d4319f5c9c4b59a3",
    "toHash": "c0c0484f6d52c56c1b788263c3656957d7e3e4a303f8e91ec0dcc2e7af2155a1",
    "decision": "needs-review",
    "configuration": {
      "duration": 0.06,
      "fromSpeed": 1,
      "toSpeed": 1,
      "anchor": "none"
    },
    "evidenceAction": {
      "id": "contract-knockback-to-getup",
      "revision": 1,
      "motionHash": "4979fd630ba613ab1ad213e6d5805f9970a1ff0866594fdcc6871d95fc303734",
      "step": 1
    },
    "seams": [
      {
        "time": 0.8333333134651184,
        "rootVelocityJumpMetersPerSecond": 0,
        "jointVelocityJumpRmsMetersPerSecond": 0.7665299381053278,
        "angularVelocityJumpRmsDegreesPerSecond": 295.773490826058
      },
      {
        "time": 0.8933333134651185,
        "rootVelocityJumpMetersPerSecond": 0,
        "jointVelocityJumpRmsMetersPerSecond": 1.0730675141007018,
        "angularVelocityJumpRmsDegreesPerSecond": 399.8322091217713
      }
    ],
    "flagCodes": [
      "connection/velocity-change"
    ],
    "reviewedAt": "2026-10-05T09:24:07.279Z",
    "reviewer": "llm-visual",
    "measurement": {
      "algorithm": "rig-motion-quality-v1",
      "sampleRate": 60,
      "measuredAt": "2026-10-05T09:24:07.279Z",
      "thresholds": {
        "floorY": 0,
        "footHeightTolerance": 0.05,
        "footSpeedTolerance": 0.15,
        "minContactDuration": 0.1,
        "contactDriftTolerance": 0.03,
        "boneLengthRelativeTolerance": 0.02,
        "scaleRelativeTolerance": 0.02,
        "rootVelocityJumpTolerance": 0.5,
        "jointVelocityJumpTolerance": 1,
        "angularVelocityJumpTolerance": 360
      }
    },
    "views": [
      "Front",
      "Side"
    ],
    "notes": "Sampled Front/Side poses connect, but configured boundary velocity changes remain. The no-anchor pose blend does not preserve motion derivatives or establish grounded balance. Keep this configuration needs-review; do not infer support from near endpoints.",
    "artifacts": [
      "authoring/reviews/catalog/sheets/knockback-to-getup-join.png",
      "authoring/reviews/catalog/built-pairs.json",
      "authoring/reviews/catalog/pairs-frames-0/frames.json",
      "authoring/reviews/catalog/pairs-frames-1/frames.json"
    ],
    "physicalValidation": "not-performed",
    "reviewRevision": 1
  },
  {
    "schemaVersion": 1,
    "contractId": "hook-to-recovery",
    "fromRevision": 1,
    "toRevision": 1,
    "fromHash": "1d093d071087f86f757a5b76446d20e6b97cc4881737ef9e3ef716ab894bbf94",
    "toHash": "81ba1d22197638c00409e4eeb4fc373f1e545777c21a8a69039e9ee773e347bb",
    "decision": "supported",
    "configuration": {
      "duration": 0.06,
      "fromSpeed": 1,
      "toSpeed": 1,
      "anchor": "none"
    },
    "evidenceAction": {
      "id": "contract-hook-to-recovery",
      "revision": 1,
      "motionHash": "62b81c7a99435a53005ec66e1763b03da4930aea35f4f5f6ad6612d459afdaf6",
      "step": 1
    },
    "seams": [
      {
        "time": 0.46666666865348816,
        "rootVelocityJumpMetersPerSecond": 0,
        "jointVelocityJumpRmsMetersPerSecond": 0.7537237151934184,
        "angularVelocityJumpRmsDegreesPerSecond": 125.87664967637443
      },
      {
        "time": 0.5266666686534882,
        "rootVelocityJumpMetersPerSecond": 0,
        "jointVelocityJumpRmsMetersPerSecond": 0.30059411931759644,
        "angularVelocityJumpRmsDegreesPerSecond": 39.742070808451366
      }
    ],
    "flagCodes": [],
    "reviewedAt": "2026-10-05T09:24:07.317Z",
    "reviewer": "llm-visual",
    "measurement": {
      "algorithm": "rig-motion-quality-v1",
      "sampleRate": 60,
      "measuredAt": "2026-10-05T09:24:07.317Z",
      "thresholds": {
        "floorY": 0,
        "footHeightTolerance": 0.05,
        "footSpeedTolerance": 0.15,
        "minContactDuration": 0.1,
        "contactDriftTolerance": 0.03,
        "boneLengthRelativeTolerance": 0.02,
        "scaleRelativeTolerance": 0.02,
        "rootVelocityJumpTolerance": 0.5,
        "jointVelocityJumpTolerance": 1,
        "angularVelocityJumpTolerance": 360
      }
    },
    "views": [
      "Front",
      "Side"
    ],
    "notes": "Five sampled Front/Side frames across the actual compiled join show continuous body pose, without configured seam flags. Exact timing/speeds only; source contacts do not certify the blend, prop interaction or physical balance.",
    "artifacts": [
      "authoring/reviews/catalog/sheets/hook-to-recovery-join.png",
      "authoring/reviews/catalog/built-pairs.json",
      "authoring/reviews/catalog/pairs-frames-0/frames.json",
      "authoring/reviews/catalog/pairs-frames-1/frames.json"
    ],
    "physicalValidation": "not-performed",
    "reviewRevision": 1
  },
  {
    "schemaVersion": 1,
    "contractId": "ninja-start-to-hold",
    "fromRevision": 1,
    "toRevision": 1,
    "fromHash": "b9e898e5939e6a09092e5679f47ec108db58e2541c4c4b7d3e167e9bae4dcab0",
    "toHash": "244ac0443dd08d5dfc2e346acd85dd8e689960d4a5e685e7715ab4d2127423f3",
    "decision": "supported",
    "configuration": {
      "duration": 0.06,
      "fromSpeed": 1,
      "toSpeed": 1,
      "anchor": "none"
    },
    "evidenceAction": {
      "id": "contract-ninja-start-to-hold",
      "revision": 1,
      "motionHash": "a52eeb00bc976d7ce092aeb21656f6626a6baec5a83c9e6a943ef461ee2f18bc",
      "step": 1
    },
    "seams": [
      {
        "time": 0.9666666388511658,
        "rootVelocityJumpMetersPerSecond": 0,
        "jointVelocityJumpRmsMetersPerSecond": 0.034299794101709774,
        "angularVelocityJumpRmsDegreesPerSecond": 4.542812182534413
      },
      {
        "time": 1.0266666388511658,
        "rootVelocityJumpMetersPerSecond": 0,
        "jointVelocityJumpRmsMetersPerSecond": 0.04865319551942472,
        "angularVelocityJumpRmsDegreesPerSecond": 8.347106088659542
      }
    ],
    "flagCodes": [],
    "reviewedAt": "2026-10-05T09:24:07.392Z",
    "reviewer": "llm-visual",
    "measurement": {
      "algorithm": "rig-motion-quality-v1",
      "sampleRate": 60,
      "measuredAt": "2026-10-05T09:24:07.392Z",
      "thresholds": {
        "floorY": 0,
        "footHeightTolerance": 0.05,
        "footSpeedTolerance": 0.15,
        "minContactDuration": 0.1,
        "contactDriftTolerance": 0.03,
        "boneLengthRelativeTolerance": 0.02,
        "scaleRelativeTolerance": 0.02,
        "rootVelocityJumpTolerance": 0.5,
        "jointVelocityJumpTolerance": 1,
        "angularVelocityJumpTolerance": 360
      }
    },
    "views": [
      "Front",
      "Side"
    ],
    "notes": "Five sampled Front/Side frames across the actual compiled join show continuous body pose, without configured seam flags. Exact timing/speeds only; source contacts do not certify the blend, prop interaction or physical balance.",
    "artifacts": [
      "authoring/reviews/catalog/sheets/ninja-start-to-hold-join.png",
      "authoring/reviews/catalog/built-pairs.json",
      "authoring/reviews/catalog/pairs-frames-0/frames.json",
      "authoring/reviews/catalog/pairs-frames-1/frames.json"
    ],
    "physicalValidation": "not-performed",
    "reviewRevision": 1
  },
  {
    "schemaVersion": 1,
    "contractId": "ninja-hold-to-land",
    "fromRevision": 1,
    "toRevision": 1,
    "fromHash": "244ac0443dd08d5dfc2e346acd85dd8e689960d4a5e685e7715ab4d2127423f3",
    "toHash": "46daac174af2edb09070d37325d71f352b3c95e1e54445068097ecfd951fc4c5",
    "decision": "needs-review",
    "configuration": {
      "duration": 0.06,
      "fromSpeed": 1,
      "toSpeed": 1,
      "anchor": "none"
    },
    "evidenceAction": {
      "id": "contract-ninja-hold-to-land",
      "revision": 1,
      "motionHash": "6a1f6fab45cba58856b205200e76b2b45dd4b02e99576cbd877bd091ec4d064e",
      "step": 1
    },
    "seams": [
      {
        "time": 2,
        "rootVelocityJumpMetersPerSecond": 0,
        "jointVelocityJumpRmsMetersPerSecond": 0.04827578822164621,
        "angularVelocityJumpRmsDegreesPerSecond": 8.036174050893434
      },
      {
        "time": 2.06,
        "rootVelocityJumpMetersPerSecond": 0,
        "jointVelocityJumpRmsMetersPerSecond": 3.8265508148809895,
        "angularVelocityJumpRmsDegreesPerSecond": 397.02221258084427
      }
    ],
    "flagCodes": [
      "connection/velocity-change"
    ],
    "reviewedAt": "2026-10-05T09:24:07.521Z",
    "reviewer": "llm-visual",
    "measurement": {
      "algorithm": "rig-motion-quality-v1",
      "sampleRate": 60,
      "measuredAt": "2026-10-05T09:24:07.521Z",
      "thresholds": {
        "floorY": 0,
        "footHeightTolerance": 0.05,
        "footSpeedTolerance": 0.15,
        "minContactDuration": 0.1,
        "contactDriftTolerance": 0.03,
        "boneLengthRelativeTolerance": 0.02,
        "scaleRelativeTolerance": 0.02,
        "rootVelocityJumpTolerance": 0.5,
        "jointVelocityJumpTolerance": 1,
        "angularVelocityJumpTolerance": 360
      }
    },
    "views": [
      "Front",
      "Side"
    ],
    "notes": "Sampled Front/Side poses connect, but configured boundary velocity changes remain. The no-anchor pose blend does not preserve motion derivatives or establish grounded balance. Keep this configuration needs-review; do not infer support from near endpoints.",
    "artifacts": [
      "authoring/reviews/catalog/sheets/ninja-hold-to-land-join.png",
      "authoring/reviews/catalog/built-pairs.json",
      "authoring/reviews/catalog/pairs-frames-0/frames.json",
      "authoring/reviews/catalog/pairs-frames-1/frames.json"
    ],
    "physicalValidation": "not-performed",
    "reviewRevision": 1
  },
  {
    "schemaVersion": 1,
    "contractId": "shield-hold-to-break",
    "fromRevision": 1,
    "toRevision": 1,
    "fromHash": "ba1d3354ad54fa35c595d1bb1bb7bb98695a44e90a5bcb6950b73fc8fe14dd66",